{"$defs":{"hex":{"pattern":"^#[0-9a-fA-F]{6}$","type":"string"},"palette":{"additionalProperties":false,"properties":{"accent":{"$ref":"#/$defs/hex"},"farBand":{"$ref":"#/$defs/hex"},"ground":{"$ref":"#/$defs/hex"},"groundShade":{"$ref":"#/$defs/hex"},"mid":{"$ref":"#/$defs/hex"},"platform":{"$ref":"#/$defs/hex"},"platformRim":{"$ref":"#/$defs/hex"},"sky":{"$ref":"#/$defs/hex"}},"required":["sky","farBand","mid","ground","groundShade","platform","platformRim","accent"],"type":"object"},"scene":{"additionalProperties":false,"properties":{"day":{"$ref":"#/$defs/palette"},"forceNite":{"type":"boolean"},"label":{"type":"string"},"motif":{"enum":["trees","buildings","waves","crystals","panels","banners","hedge"]},"nite":{"$ref":"#/$defs/palette"}},"required":["label","motif","forceNite","day","nite"],"type":"object"},"tint":{"additionalProperties":false,"properties":{"alpha":{"maximum":1,"minimum":0,"type":"number"},"color":{"$ref":"#/$defs/hex"}},"required":["color","alpha"],"type":"object"}},"$id":"./battle-scenes.schema.json","$schema":"https://json-schema.org/draft/2020-12/schema","additionalProperties":false,"properties":{"note":{"type":"string"},"phaseTint":{"additionalProperties":{"$ref":"#/$defs/tint"},"propertyNames":{"enum":["morn","eve"]},"type":"object"},"scenes":{"additionalProperties":{"$ref":"#/$defs/scene"},"minProperties":1,"type":"object"},"version":{"const":1}},"required":["version","scenes","phaseTint"],"title":"battle-scenes (src/data/core/battle-scenes.json)","type":"object"}