{"note":"Battle background scenes, HGSS grammar (pret-pokeheartgold, CODE grade): one composed scene per BattleBg id — far field, mid band with silhouette motif, battler ground with two standing platforms — recoloured by time of day. Palettes here are Mochiichao's own. Each scene authors a DAY and a NITE palette; MORN/EVE are the day palette under the clock tint machinery (WorldConstants DAY_TINT values, mirrored in phaseTint below), LATE is the nite palette. forceNite mirrors HGSS battle_setup.c: cave backgrounds force RTC_TIMEOFDAY_NITE.","phaseTint":{"eve":{"alpha":0.18,"color":"#b45028"},"morn":{"alpha":0.14,"color":"#ffa050"}},"scenes":{"cave":{"day":{"accent":"#ffb347","farBand":"#2e2620","ground":"#4a3b2e","groundShade":"#3c2f24","mid":"#3a2f26","platform":"#5d4a38","platformRim":"#6e5840","sky":"#241d18"},"forceNite":true,"label":"Cave / tunnel (dark)","motif":"crystals","nite":{"accent":"#ff9a3c","farBand":"#1a1512","ground":"#2f251c","groundShade":"#251c15","mid":"#241c16","platform":"#3d2f22","platformRim":"#4c3a29","sky":"#120e0c"}},"dojo":{"day":{"accent":"#8c2f22","farBand":"#b3452f","ground":"#a97f4f","groundShade":"#93703f","mid":"#cbb489","platform":"#d9c491","platformRim":"#b3452f","sky":"#e3d3ae"},"forceNite":false,"label":"Dojo interior","motif":"banners","nite":{"accent":"#ffca7a","farBand":"#6e2a20","ground":"#5f4a30","groundShade":"#4e3c26","mid":"#57452f","platform":"#77683f","platformRim":"#6e2a20","sky":"#463c30"}},"garden":{"day":{"accent":"#ff9ecb","farBand":"#5da85e","ground":"#4da33c","groundShade":"#418c33","mid":"#6cb95a","platform":"#cbb98a","platformRim":"#a08c5f","sky":"#8fd3f4"},"forceNite":false,"label":"Mochii Garden","motif":"hedge","nite":{"accent":"#7fd0ff","farBand":"#14301c","ground":"#21512c","groundShade":"#1a4023","mid":"#1a4023","platform":"#5d5340","platformRim":"#453d2e","sky":"#0e1e38"}},"interior":{"day":{"accent":"#7a5c3a","farBand":"#c3ab84","ground":"#9a7c52","groundShade":"#86684a","mid":"#b89a6e","platform":"#c9b18a","platformRim":"#a98f66","sky":"#d8c6a8"},"forceNite":false,"label":"Interior / building","motif":"panels","nite":{"accent":"#ffca7a","farBand":"#3c342c","ground":"#5d4a36","groundShade":"#4c3a2b","mid":"#544639","platform":"#77644a","platformRim":"#5d4c38","sky":"#4a4038"}},"route":{"day":{"accent":"#2e6b21","farBand":"#4e9e4f","ground":"#3f8f2f","groundShade":"#357a28","mid":"#57a83c","platform":"#8a6f4d","platformRim":"#6d5638","sky":"#7ec8f7"},"forceNite":false,"label":"Route / tall grass","motif":"trees","nite":{"accent":"#0f2413","farBand":"#122a1e","ground":"#1d4423","groundShade":"#17351b","mid":"#17351f","platform":"#4a3d2c","platformRim":"#33291d","sky":"#0d1b3a"}},"town":{"day":{"accent":"#8a5a3b","farBand":"#b08968","ground":"#b7a98f","groundShade":"#a08d70","mid":"#cbb59a","platform":"#9c8b6f","platformRim":"#7d6c52","sky":"#86c9f5"},"forceNite":false,"label":"Town / city street","motif":"buildings","nite":{"accent":"#ffd98a","farBand":"#1d2440","ground":"#3a3f55","groundShade":"#2e3347","mid":"#2b3049","platform":"#565064","platformRim":"#403a4e","sky":"#101d3d"}},"water":{"day":{"accent":"#ffffff","farBand":"#3f8fd2","ground":"#1f6fc4","groundShade":"#1a5fa8","mid":"#2f7fd0","platform":"#2b83d6","platformRim":"#bfe6ff","sky":"#7ec8f7"},"forceNite":false,"label":"Water's edge / surfing","motif":"waves","nite":{"accent":"#cfeaff","farBand":"#10355e","ground":"#0d3f6e","groundShade":"#0a335c","mid":"#0f4a7a","platform":"#12598f","platformRim":"#7fb6dd","sky":"#0a1830"}}},"version":1}